{
  "schema_version": "1.0.0",
  "transition_id": "77777777-7777-4777-8777-777777777777",
  "survey_id": "11111111-1111-4111-8111-111111111111",
  "policy_id": "route_v0_log_only",
  "state": {"coverage": 0.73, "impact_band": "high"},
  "action": "human_review",
  "action_source": "jev+policy",
  "fable": null,
  "astra": null,
  "jev": null,
  "human_truth": null,
  "independent_outcome": null,
  "reward": null,
  "next_state_id": null,
  "cost_usd": 0,
  "elapsed_ms": 0
}
